<?xml version="1.0" encoding="UTF-8" standalone="no"?>
<XMLSchema_VN7XCW xmlns:xsi="http://www.w3.org/2001/XMLSchema-instance" xsi:noNamespaceSchemaLocation="XMLSchema_VN7XCW.xsd">
        
    <Employee>
                
        <ID>E001</ID>
                
        <FirstName>John</FirstName>
                
        <LastName>Doe</LastName>
                
        <PhoneNumber>123456789</PhoneNumber>
                
        <Email>johndoe@example.com</Email>
                
        <MedicalNumber>M123</MedicalNumber>
                
        <DateOfBirth>1990-05-15</DateOfBirth>
                
        <BankAccountNumber>ABC123456</BankAccountNumber>
                
        <Payment>Salary</Payment>
            
    </Employee>
        
    <!-- Works instance -->
        
    <Works>
                
        <EmpID>E001</EmpID>
                
        <ResID>R001</ResID>
                
        <FromWhen>2023-01-01</FromWhen>
                
        <IsLeader>true</IsLeader>
            
    </Works>
        
    <!-- Restaurant instance -->
        
    <Restaurant>
                
        <ID>R001</ID>
                
        <Name>Sample Restaurant</Name>
                
        <PhoneNumber>987654321</PhoneNumber>
                
        <Email>sample@example.com</Email>
                
        <Country>Country</Country>
                
        <City>City</City>
                
        <Street>Main Street</Street>
                
        <HouseNumber>123</HouseNumber>
            
    </Restaurant>
        
    <!-- Order instance -->
        
    <Order>
                
        <ID>O001</ID>
                
        <PaymentType>Credit Card</PaymentType>
                
        <ResID>R001</ResID>
            
    </Order>
        
    <!-- OrderedProducts instance -->
        
    <OrderedProducts>
                
        <ProID>P001</ProID>
                
        <OrdID>O001</OrdID>
            
    </OrderedProducts>
        
    <!-- Product instance -->
        
    <Product>
                
        <ID>P001</ID>
                
        <Name>Product Name</Name>
                
        <Type>Type</Type>
                
        <Price>10.99</Price>
            
    </Product>
        
    <!-- ContainedIngredients instance -->
        
    <ContainedIngredients>
                
        <IngID>I001</IngID>
                
        <ProID>P001</ProID>
            
    </ContainedIngredients>
        
    <!-- Ingredients instance -->
        
    <Ingredients>
                
        <ID>I001</ID>
                
        <Ingredient>Ingredient Name</Ingredient>
            
    </Ingredients>
        
    <!-- CustomerOrder instance -->
        
    <CustomerOrder>
                
        <CusID>C001</CusID>
                
        <OrdID>O001</OrdID>
                
        <DateAndTime>2023-11-26T10:00:00</DateAndTime>
            
    </CustomerOrder>
        
    <!-- Customer instance -->
        
    <Customer>
                
        <ID>C001</ID>
                
        <FirstName>Jane</FirstName>
                
        <LastName>Smith</LastName>
                
        <PhoneNumber>555555555</PhoneNumber>
                
        <Email>janesmith@example.com</Email>
                
        <DateOfBirth>1995-08-20</DateOfBirth>
                
        <Country>Country</Country>
                
        <City>City</City>
                
        <Street>Sample Street</Street>
                
        <HouseNumber>456</HouseNumber>
            
    </Customer>
        
    <!-- Employee instance -->
        
    <Employee>
                
        <ID>E002</ID>
                
        <FirstName>Alice</FirstName>
                
        <LastName>Smith</LastName>
                
        <PhoneNumber>987654321</PhoneNumber>
                
        <Email>alice@example.com</Email>
                
        <MedicalNumber>M456</MedicalNumber>
                
        <DateOfBirth>1988-10-20</DateOfBirth>
                
        <BankAccountNumber>XYZ987654</BankAccountNumber>
                
        <Payment>Hourly</Payment>
            
    </Employee>
        
    <!-- Works instance -->
        
    <Works>
                
        <EmpID>E002</EmpID>
                
        <ResID>R002</ResID>
                
        <FromWhen>2022-05-01</FromWhen>
                
        <IsLeader>false</IsLeader>
            
    </Works>
        
    <!-- Restaurant instance -->
        
    <Restaurant>
                
        <ID>R002</ID>
                
        <Name>Another Restaurant</Name>
                
        <PhoneNumber>123123123</PhoneNumber>
                
        <Email>another@example.com</Email>
                
        <Country>Country2</Country>
                
        <City>City2</City>
                
        <Street>Another Street</Street>
                
        <HouseNumber>789</HouseNumber>
            
    </Restaurant>
        
    <!-- Order instance -->
        
    <Order>
                
        <ID>O002</ID>
                
        <PaymentType>Debit Card</PaymentType>
                
        <ResID>R002</ResID>
            
    </Order>
        
    <!-- OrderedProducts instance -->
        
    <OrderedProducts>
                
        <ProID>P002</ProID>
                
        <OrdID>O002</OrdID>
            
    </OrderedProducts>
        
    <!-- Product instance -->
        
    <Product>
                
        <ID>P002</ID>
                
        <Name>Another Product</Name>
                
        <Type>Type2</Type>
                
        <Price>25.50</Price>
            
    </Product>
        
    <!-- ContainedIngredients instance -->
        
    <ContainedIngredients>
                
        <IngID>I002</IngID>
                
        <ProID>P002</ProID>
            
    </ContainedIngredients>
        
    <!-- Ingredients instance -->
        
    <Ingredients>
                
        <ID>I002</ID>
                
        <Ingredient>Another Ingredient</Ingredient>
            
    </Ingredients>
        
    <!-- CustomerOrder instance -->
        
    <CustomerOrder>
                
        <CusID>C002</CusID>
                
        <OrdID>O002</OrdID>
                
        <DateAndTime>2023-11-27T15:30:00</DateAndTime>
            
    </CustomerOrder>
        
    <!-- Customer instance -->
        
    <Customer>
                
        <ID>C002</ID>
                
        <FirstName>Bob</FirstName>
                
        <LastName>Johnson</LastName>
                
        <PhoneNumber>111111111</PhoneNumber>
                
        <Email>bob@example.com</Email>
                
        <DateOfBirth>1992-03-12</DateOfBirth>
                
        <Country>Country2</Country>
                
        <City>City2</City>
                
        <Street>Second Street</Street>
                
        <HouseNumber>321</HouseNumber>
            
    </Customer>
        
    <!-- Employee instance -->
        
    <Employee>
                
        <ID>E003</ID>
                
        <FirstName>Sophia</FirstName>
                
        <LastName>Johnson</LastName>
                
        <PhoneNumber>555222333</PhoneNumber>
                
        <Email>sophia@example.com</Email>
                
        <MedicalNumber>M789</MedicalNumber>
                
        <DateOfBirth>1995-12-10</DateOfBirth>
                
        <BankAccountNumber>DEF456789</BankAccountNumber>
                
        <Payment>Commission</Payment>
            
    </Employee>
        
    <!-- Works instance -->
        
    <Works>
                
        <EmpID>E003</EmpID>
                
        <ResID>R003</ResID>
                
        <FromWhen>2023-03-15</FromWhen>
                
        <IsLeader>false</IsLeader>
            
    </Works>
        
    <!-- Restaurant instance -->
        
    <Restaurant>
                
        <ID>R003</ID>
                
        <Name>Third Restaurant</Name>
                
        <PhoneNumber>999888777</PhoneNumber>
                
        <Email>third@example.com</Email>
                
        <Country>Country3</Country>
                
        <City>City3</City>
                
        <Street>Third Street</Street>
                
        <HouseNumber>4567</HouseNumber>
            
    </Restaurant>
        
    <!-- Order instance -->
        
    <Order>
                
        <ID>O003</ID>
                
        <PaymentType>Cash</PaymentType>
                
        <ResID>R003</ResID>
            
    </Order>
        
    <!-- OrderedProducts instance -->
        
    <OrderedProducts>
                
        <ProID>P003</ProID>
                
        <OrdID>O003</OrdID>
            
    </OrderedProducts>
        
    <!-- Product instance -->
        
    <Product>
                
        <ID>P003</ID>
                
        <Name>Product Three</Name>
                
        <Type>Type3</Type>
                
        <Price>12.75</Price>
            
    </Product>
        
    <!-- ContainedIngredients instance -->
        
    <ContainedIngredients>
                
        <IngID>I003</IngID>
                
        <ProID>P003</ProID>
            
    </ContainedIngredients>
        
    <!-- Ingredients instance -->
        
    <Ingredients>
                
        <ID>I003</ID>
                
        <Ingredient>Ingredient Three</Ingredient>
            
    </Ingredients>
        
    <!-- CustomerOrder instance -->
        
    <CustomerOrder>
                
        <CusID>C003</CusID>
                
        <OrdID>O003</OrdID>
                
        <DateAndTime>2023-11-28T09:45:00</DateAndTime>
            
    </CustomerOrder>
        
    <!-- Customer instance -->
        
    <Customer>
                
        <ID>C003</ID>